"id","heading","images","description","reporter","town","city","reporter_id","featured","status","top_news","top_new_b1","top_new_b2","top_new_b3","created_at","updated_at"
"83","راولپنڈی کی ضلعی انتظامیہ نے آئندہ بارش اور برفباری سے قبل ایک نئے ہنگامی پلان کو حتمی شکل دی ہے۔","[""uOPyhrgIV0.jpg""]","محکمہ موسمیات کی جانب سے منگل 18 جنوری اور جمعرات 20 جنوری کو پہاڑی علاقوں میں ایک بار بھر بارش اور برف باری کی پیش گوئی کی گئی ہے۔

محکمہ موسمیات نے تمام متعلقہ محکموں کو قبل از وقت مناسب انتظامات کرنے کی ہدایت دی ہے۔

نئے پلان کے مطابق مری میں آئندہ اس طرح کے سانحے سے بچنے کے لیے ایڈیشنل ڈپٹی کمشنر اور تین اسسٹنٹ کمشنرز کو تعینات کر دیا گیا ہے۔

علاوہ ازیں تحقیقاتی کمیٹی، جو 16 جنوری کو اپنی رپورٹ وزیر اعلیٰ پنجاب سردار عثمان بزدار کو پیش کرے گی، اب اسلام آباد میں پنجاب ہاؤس میں ڈیرے ڈالے ہوئے ہے۔

مزید پڑھیں: سانحہ مری: محکمہ موسمیات کے شدید برفباری کے انتباہ پر توجہ نہیں دی گئی

دوسری طرف مقامی تاجر نے ہتھیار اٹھائے ہوئے ہیں کیونکہ پچھلے ایک ہفتے سے ہل اسٹیشن میں تمام تجارتی سرگرمیاں ٹھپ ہیں۔

تاجروں، مزدوروں، ٹرانسپورٹرز اور دیگر کی جانب سے آج (ہفتہ) مری ایکسپریس وے پر احتجاجی مظاہرہ متوقع ہے تاکہ ضلعی انتظامیہ پر سڑکیں کھولنے اور کاروباری سرگرمیاں دوبارہ شروع کرنے کی اجازت دی جائے۔","اسد",NULL,"ڈنگہ","9","0","1","0",NULL,NULL,NULL,"2022-01-15 15:45:22","2022-10-07 19:17:37"
"84","چین فری ٹریڈ معاہدے (سی پی ایف ٹی اے) کے غلط استعمال کی خبروں کے باعث حکومت نے تمام آئل مارکیٹنگ کمپنیوں کو ثبوتوں کے ساتھ اعداد و شمار کی بنیاد پر چین سے درآمد شدہ پیٹرول کی تفصیلات فراہم کرنے کا حکم دیا ہے","[""PZ0GI3M12m.jpg""]","سی پی ایف ٹی اے کے تحت دوبارہ کیے گئے مذاکرات کے تحت، حکومت نے 31 دسمبر 2019 کو قانونی ریگولیٹری احکامات جاری کیے تھے جس میں پیٹرول کی درآمد پر ٹیرف کو ختم کر دیا گیا تھا۔ یکم جنوری 2020 سے چین سے پیٹرول کی درآمد پر کوئی کسٹم ڈیوٹی نہیں تھی۔

دیگر تمام ذرائع، زیادہ تر مشرق وسطیٰ سے عام پیٹرولیم مصنوعات کی درآمدات پر 10 فیصد کسٹم ڈیوٹی لگائی جاتی ہے جبکہ اسی طرح کی ڈیوٹی مقامی ریفائنریز کی پیداوار پر لاگو ہوتی ہے۔

یہ بھی پڑھیں: حکومت کا پیٹرول بحران کی تحقیقات کیلئے انکوائری کمیشن بنانے کا فیصلہ

اس کے نتیجے کے طور پر چین سے درآمد پیٹرول پر 10 فیصد کی بچت ہوئی تاہم اس کا فائدہ صارفین کو منتقل کرنے کے بجائے کمپنیوں نے منافع کو ونڈفال پرافٹ کے طور برقرار رکھا جبکہ عالمی پلاٹس آئل گرام رپورٹ کے مطابق پیٹرول کی فی لیٹر قیمت میں 9 روپے سے 12 روپے تک کا روزانہ فرق ہوتا ہے۔

وزارت توانائی کا دو درجن کے قریب آئل کمپنیوں اور ریفائنزیز کی تنظیم آئل کمپنی ایڈوائزری کونسل (او سی اے سی) کو لکھے گئے خط میں کہنا ہے کہ کئی آئل مارکیٹنگ کمپنیوں نے سی پی ایف ٹی اے کے تحت چین سے پیٹرول درآمد کیا ہے۔

خط میں کہا گیا ہے کہ او سی اے سی یقینی بنائے کہ تمام آئل مارکیٹنگ کمپنیاں اپنی درآمد سے متعلق گزشتہ دو سال یعنی جنوری 2020 سے جنوری 2022 تک کی درآمد کی مکمل تفصیلات دس روز کے اندر فراہم کریں۔

مکمل معلومات میں کارگو کا نام، جس بندرگاہ سے کارگو لوڈ کیا گیا اس کا نام، پیٹرول کی مقدار، جس بندرگاہ پر پیٹرول اتارا گیا تاریخ کے ساتھ اس کا نام اور جو کسٹم ڈیوٹی ادا کی گئی اس کی تفصیلات طلب کی گئی ہیں۔

مزید پڑھیں: آئل کمپنیوں نے بیوروکریسی کو پیٹرول بحران کا ذمہ دار ٹھہرادیا

دلچسپ بات یہ ہے کہ 28 اپریل 2019 میں دستخط کردہ تجارتی معاہدے کا بنیادی مقصد شفاف مثبت تجارتی مقابلے کی حوصلہ افزائی کرنا تھا۔

چین خود پیٹرولیم مصنوعات کو درآمد کرنے والا ملک ہے جس کی پیٹرول اور ٹرانسپورٹیشن قیمت بھی پاکستان کے لیے مشرق وسطیٰ سے زیادہ ہے۔

اس کے باجود یہ معاہدہ آئل مارکیٹنگ کمپنیوں کو اچھا خاصا مارجن دیتا ہے، سی پی ایف ٹی اے کے تحت یہ پوزیشن یکم جنوری 2020 سے 31 دسمبر 2024 تک برقرار رہے گی۔

یہ اس حقیقت کے باوجود ہوتا ہے کہ مقامی ریفائنریز سال بھر کم صلاحیتی استعال پر رو رہی ہوتی ہیں اور بعض اوقات اپنی ریفائننگ سہولیات کو مکمل طور پر بند کر دیتی ہیں، جس کی بنیادی وجہ پیٹرولیم مصنوعات کی زیادہ درآمد ہے۔

پانچ میں سے تین مقامی ریفائنریز نے پچھلے دو ہفتوں کے دوران کام روک دیا ہے۔

یہ بھی پڑھیں: آئل مارکیٹنگ کمپنیوں نے پیٹرول کی قلت کی ذمہ داری وزارت توانائی پر ڈال دی

گزشتہ ماہ مقامی ریفائنریز نے حکومت کو بتایا تھا کہ اگر مقامی ریفائنریز کو مکمل صلاحیت کے ساتھ چلایا جائے تو پیٹرول اور ہائی اسپیڈ ڈیزل کی مقامی پیداوار بالترتیب 60 اور 48 فیصد تک اوپر جاسکتی ہے جس سے قیمتی زرمبادلہ کی بچت میں مدد ملے گی۔

رواں مالی سال کے گزشتہ پانچ ماہ کے دوران تیل کا درآمدی بل خاص طور پر ریفائنڈ پیٹرولیم مصنوعات کا بل جو کہ درآمدات بل کا سب سے بڑا تقریبا 83 فیصد حصہ ہے اور گزشتہ ماہ حصص کی قیمتیں گرنے سے حکومتی حلقوں میں بے چینی پھیل گئی تھی۔

مقامی ریفائنریز اپنے آپریشنل چیلنجز کا سامنا کر رہی ہیں کیونکہ توانائی کمپنیوں کی جانب سے کم فرنس آئل لیا جارہاہے اور آئل مارکیٹنگ کمپنیوں کے پاس اس کے ذخیرہ کرنے کی گنجائش پیٹرول اور ڈیزل سے کم ہے۔","اسد",NULL,"ڈنگہ","9","0","1","0",NULL,NULL,NULL,"2022-01-15 15:46:55","2022-10-07 19:17:37"
"85","محکمہ اسپیشلائزڈ ہیلتھ کیئر اینڈ میڈیکل ایجوکیشن نے سابق وزیراعظم نواز شریف کے معالج ڈاکٹر ڈیوڈ لارنس کی جانب سے جمع کرائی گئی میڈیکل رپورٹس کی جانچ پڑتال کے لیے 9 رکنی خصوصی میڈیکل بورڈ تشکیل دے دیا۔","[""kEfEynZ7ju.jpg""]","پروفیسر آف میڈیسن ڈاکٹر محمد عارف نعیم کی سربراہی میں بورڈ کی تشکیل وفاقی کابینہ کی ہدایات پر کی گئی جو نواز شریف کے معالج کی طرف سے پیش کی گئی رپورٹس کا جائزہ لے گا اور مریض کی جسمانی حالت اور پاکستان واپس جانے کی صلاحیت کے حوالے سے ماہرانہ طبی رائے پیش کرے گا۔

نواز شریف نومبر 2019 میں لاہور ہائی کورٹ سے علاج کے لیے 4 ہفتے کی ضمانت منظور کیے جانے کے بعد برطانیہ روانہ ہو گئے تھے۔

یہ بھی پڑھیں: وفاقی حکومت کی پنجاب سے نواز شریف کی رپورٹس کے جائزے کیلئے میڈیکل بورڈ کی درخواست

بورڈ کے اراکین میں پروفیسر ڈاکٹر غیاث نبی طیب، پروفیسر ڈاکٹر ثاقب سعید، پروفیسر ڈاکٹر شاہد حمید، پروفیسر ڈاکٹر بلال ایس محی الدین، پروفیسر ڈاکٹر عنبرین حامد، پروفیسر ڈاکٹر شفیق الرحمٰن، پروفیسر ڈاکٹر مونا عزیز اور ڈاکٹر خدیجہ عرفان خواجہ شامل ہیں۔

بورڈ کو ہدایت کی گئی ہے کہ وہ 5 روز کے اندر اپنی رپورٹ اور ماہرانہ طبی رائے اسپیشلائزڈ ہیلتھ کیئر سیکریٹری کو پیش کرے۔","اسد",NULL,"ڈنگہ","9","0","1","0",NULL,NULL,NULL,"2022-01-15 15:48:15","2022-10-07 19:17:37"
"86","حکومت نے غیر ملکی سرمایہ کاروں کو پاکستانی شہریت دینے کا فیصلہ کیا ہے، یہ فیصلہ خاص طور پر افغان اور چینی شہریوں سے بھاری سرمایہ کاری حاصل کرنے کے لیے کیا گیا ہے۔","[""Kkn5ztJ6mL.png""]","وزیر اطلاعات فواد چوہدری نے ایک ٹوئٹ کے ذریعے اس منصوبے کی تصدیق کی۔

حکومت کا خیال ہے کہ وہ غیر ملکی سرمایہ کاروں کو پاکستانی شہریت اور ملکیتی حقوق دے کر اربوں ڈالر کی غیر ملکی سرمایہ کاری حاصل کرے گی۔

مزید پڑھیں: غیر ملکی سرمایہ کاروں کو شہریت دینے کے حوالے سے یکساں پالیسی بنائی جائے، وزیر اعظم

فواد چوہدری نے پاکستان کی نئی قومی سلامتی پالیسی کے پیش نظر جیو اکنامکس کو اپنے قومی سلامتی کے نظریے کا بنیاد قرار دیا۔

انہوں نے کہا کہ حکومت نے غیر ملکی شہریوں کے لیے مستقل رہائش کی اسکیم کی اجازت دینے کا فیصلہ کیا ہے، نئی پالیسی غیر ملکیوں کو سرمایہ کاری کے بدلے مستقل رہائشی کا درجہ حاصل کرنے کی اجازت دیتی ہے۔","اسد",NULL,"ڈنگہ","9","0","1","0",NULL,NULL,NULL,"2022-01-15 15:56:56","2022-10-07 19:17:37"
"87","عزیز بھٹی شہید ہسپتال سے اغواء ہونے والا نومولود بچہ پولیس نے دو گھنٹے کے اندر بازیاب کروالیا۔ خاتون اغواء کار گرفتار*","[""sDnK8mAVY3.jpg""]","*گجرات: عزیز بھٹی شہید ہسپتال سے اغواء ہونے والا نومولود ب پولیس نے دو گھنٹے کے اندر بازیاب کروالیا۔ خاتون اغواء کار گرفتار*
تفصیلات کے مطابق موضع جمالپور سیداں کی رہائشی خاتون مسمات نسرین بی بی زوجہ فضل عباس کے ہاں عزیز بھٹی شہید ہسپتال میں بچے کی پیدائش ہوئی۔ نومولود بچے کو پیدائش کے تقریبا دو گھنٹے بعد بوقت 5:30 بجیشام پراسرار طور پر ہسپتال سے اغواء کر لیا گیا۔ واقع کی اطلاع ملتے ہی ڈی ایس پی سٹی اور ایس ایچ او تھانہ سول لائنز نے نفری کے ہمراہ فوراً جائے وقوعہ پر پہنچ کر تفتیش شروع کردی۔ واقع کی حساسیت کے پیش نظر ڈی پی او گجرات عمر سلامت نے ڈی ایس پی سٹی پرویز اقبال گوندل کی قیادت میں خصوصی ٹیم تشکیل دی۔ جس میں ایس ایچ او تھانہ سول لائن امیر عباس، پی ایس او عمران فاروق سوہی اور اے ایس آئی دلدار احمد شامل ہیں۔ جنہوں نے سی سی ٹی کیمروں کی مدد سے خاتون اغواء کار کو شناخت کر لیا اور جدید ٹیکنالوجی کا استعمال کرتے ہوئے دو گھنٹے کے قلیل وقت کے اندر مغوی بچے کو بحفاظت بازیاب کرا لیا۔ پولیس نے خاتون اغواء کار شاہدہ بی بی زوجہ حسن سکنہ چوہدووال کو گرفتار کرلیا ہے ۔ملزمہ سے مزید تفتش جاری ہے۔","Superadmin",NULL,"گجرات","3","1","1","1","uploads/news/fjHXWFVG4F.png","uploads/news/fjHXWFVG4F.png","uploads/news/fjHXWFVG4F.png","2022-01-17 14:42:34","2022-01-17 14:42:34"
"88","ورونا وائرس کی ابتدا سے ہی آسٹریلیا جانے کے خواہش مند افراد کو دنیا میں امیگریشن اور قرنطینہ کے سخت ترین عمل سے گزرنا پڑ رہا تھا۔ اگرچہ آسٹریلیا کے ویزا رکھنے والے ویکسینیٹڈ افراد کے لیے اس میں کچھ نرمی ضرور کی گئی","[""boJ5XGKSB4.png""]","یہی وجہ ہے کہ جب ویکسین نہ لگوانے والے ٹینس کھلاڑی نوواک جوکووچ نے اعلان کیا کہ وہ آسٹریلین اوپن میں اپنے ٹائٹل کا دفاع کرنے کے لیے میلبرن جارہے ہیں اور انہیں قرنطینہ سے مستثنیٰ کردیا گیا ہے تو آسٹریلوی شہریوں اور دنیا بھر کے لوگوں کو حیرت ہوئی۔

کچھ لوگوں کے نزدیک یہ اجازت دراصل امیر اور طاقتور افراد کے حق میں قوانین کو نرم کرنے کے مترادف تھی جو کسی عام آدمی کے لیے نہیں کی جاتیں۔ جب ٹینس کے ایک مشہور کھلاڑٰی ہونے کے باوجود بھی وائرس نے انہیں نہیں چھوڑا تو پھر امیگریشن انتظامیہ نے ان کے لیے قوانین میں نرمی کیوں کی؟

تادمِ تحریر نوواک جوکووچ کے ویزا کا معاملہ غیر یقینی کا شکار ہے، ویزا قوانین کا دوہرا معیار اس قانون پر بہت بڑا سوالیہ نشان ہے۔ کیا کسی قانون کا نفاذ اتنا غیر منصفانہ ہوسکتا ہے کہ ہمارے پاس اس پر عمل کرنے کی کوئی معقول وجہ ہی نہ ہو؟","اعظم انصاری",NULL,"جلالپور جٹاں","11","0","1","0",NULL,NULL,NULL,"2022-01-18 17:06:18","2022-02-17 13:32:37"
"93","تعس تعس  تعس","[""qw14wQBnEm.png""]","تعس تعس  تعس","Superadmin",NULL,"گجرات","3","1","1","1",NULL,NULL,NULL,"2022-02-22 01:25:54","2022-02-23 10:40:24"
"94","گجگجگ گج","[""qvXlTrD4PS.png""]","یہی وجہ ہے کہ جب ویکسین نہ لگوانے والے ٹینس کھلاڑی نوواک جوکووچ نے اعلان کیا کہ وہ آسٹریلین اوپن میں اپنے ٹائٹل کا دفاع کرنے کے لیے میلبرن جارہے ہیں اور انہیں قرنطینہ سے مستثنیٰ کردیا گیا ہے تو آسٹریلوی شہریوں اور دنیا بھر کے لوگوں کو حیرت ہوئی۔ کچھ لوگوں کے نزدیک یہ اجازت دراصل امیر اور طاقتور افراد کے حق میں قوانین کو نرم کرنے کے مترادف تھی جو کسی عام آدمی کے لیے نہیں کی جاتیں۔ جب ٹینس کے ایک مشہور کھلاڑٰی ہونے کے باوجود بھی وائرس نے انہیں نہیں چھوڑا تو پھر امیگریشن انتظامیہ نے ان کے لیے قوانین میں نرمی کیوں کی؟ تادمِ تحریر نوواک جوکووچ کے ویزا کا معاملہ غیر یقینی کا شکار ہے، ویزا قوانین کا دوہرا معیار اس قانون پر بہت بڑا سوالیہ نشان ہے۔ کیا کسی قانون کا نفاذ اتنا غیر منصفانہ ہوسکتا ہے کہ ہمارے پاس اس پر عمل کرنے کی کوئی معقول وجہ ہی نہ ہو؟

یہی وجہ ہے کہ جب ویکسین نہ لگوانے والے ٹینس کھلاڑی نوواک جوکووچ نے اعلان کیا کہ وہ آسٹریلین اوپن میں اپنے ٹائٹل کا دفاع کرنے کے لیے میلبرن جارہے ہیں اور انہیں قرنطینہ سے مستثنیٰ کردیا گیا ہے تو آسٹریلوی شہریوں اور دنیا بھر کے لوگوں کو حیرت ہوئی۔ کچھ لوگوں کے نزدیک یہ اجازت دراصل امیر اور طاقتور افراد کے حق میں قوانین کو نرم کرنے کے مترادف تھی جو کسی عام آدمی کے لیے نہیں کی جاتیں۔ جب ٹینس کے ایک مشہور کھلاڑٰی ہونے کے باوجود بھی وائرس نے انہیں نہیں چھوڑا تو پھر امیگریشن انتظامیہ نے ان کے لیے قوانین میں نرمی کیوں کی؟ تادمِ تحریر نوواک جوکووچ کے ویزا کا معاملہ غیر یقینی کا شکار ہے، ویزا قوانین کا دوہرا معیار اس قانون پر بہت بڑا سوالیہ نشان ہے۔ کیا کسی قانون کا نفاذ اتنا غیر منصفانہ ہوسکتا ہے کہ ہمارے پاس اس پر عمل کرنے کی کوئی معقول وجہ ہی نہ ہو؟


یہی وجہ ہے کہ جب ویکسین نہ لگوانے والے ٹینس کھلاڑی نوواک جوکووچ نے اعلان کیا کہ وہ آسٹریلین اوپن میں اپنے ٹائٹل کا دفاع کرنے کے لیے میلبرن جارہے ہیں اور انہیں قرنطینہ سے مستثنیٰ کردیا گیا ہے تو آسٹریلوی شہریوں اور دنیا بھر کے لوگوں کو حیرت ہوئی۔ کچھ لوگوں کے نزدیک یہ اجازت دراصل امیر اور طاقتور افراد کے حق میں قوانین کو نرم کرنے کے مترادف تھی جو کسی عام آدمی کے لیے نہیں کی جاتیں۔ جب ٹینس کے ایک مشہور کھلاڑٰی ہونے کے باوجود بھی وائرس نے انہیں نہیں چھوڑا تو پھر امیگریشن انتظامیہ نے ان کے لیے قوانین میں نرمی کیوں کی؟ تادمِ تحریر نوواک جوکووچ کے ویزا کا معاملہ غیر یقینی کا شکار ہے، ویزا قوانین کا دوہرا معیار اس قانون پر بہت بڑا سوالیہ نشان ہے۔ کیا کسی قانون کا نفاذ اتنا غیر منصفانہ ہوسکتا ہے کہ ہمارے پاس اس پر عمل کرنے کی کوئی معقول وجہ ہی نہ ہو؟","Reporter 2",NULL,"گجرات","6","1","1","1","uploads/news/acwECS7CeC.png","uploads/news/z20nHwj10a.jpg","uploads/news/c3jzilhPDg.jpg","2022-02-22 13:52:09","2022-02-24 14:11:33"
"95","گجرات کے جیالے متحرک ہوگئے ہیں سات مارچ کو بلاول بھٹو زرداری کااہل گجرات تاریخ سازاستقبال کریں","[""FRggDdjdY0.jpg""]","کستان پیپلزپارٹی کے رہنما سابق صدر میاں فخرمشتاق پگانوالہ نے کہاکہ گجرات کے جیالے متحرک ہوگئے ہیں سات مارچ کو جی ٹی ایس چوک پر محترمہ بے نظیربھٹو شہید کے صاحبزادے بلاول بھٹو زرداری کااہل گجرات تاریخ سازاستقبال کریں گے وہ گزشتہ روز شعبہ خواتین کے زیراہتمام ریلوے روڈ پرخواتین اکٹھ سے خطاب کررہے تھے میاں فخرنے کہاکہ جیالوں کومتحرک کرنے کے لئے گجرات شہر کو پیپلزپارٹی کاگڑھ بنانے کے لئے ایک ایک کارکن جیالے کے پاس جارہے ہیں انشاء اللہ گجرات لانگ مارچ مثالی استقبال ہوگا۔خطاب کرتے ہوئے زاہد حسین سلیمی نے کہاکہ چیئرمین بلاول بھٹو کالانگ مارچ اقتدارکے لئے نہیں عوام کے حقوق بحال کرنے کے لئے ہے اہل گجرات تاریخ سازاستقبال کرینگے خطاب کرتے ہوئے سٹی صدرمیرانجم،جنرل سیکرٹری عامرلطیف طور،سینئرنائب صدرملک عرفان رفیع نے کہاکہ پیپلزپارٹی گجرات سٹی لانگ مارچ استقبالیہ پروگرام کے حوالے سے دن رات محنت کررہی ہے گجرات شہرکے جی ٹی ایس چوک پرسات مارچ کوجیالوں کا عظیم الشان اجتماع ہوگا جوبے نظیربھٹو شہید کے لخت جگر بلاول بھٹو کے تاریخی لانگ مارچ کاوالہا نہ استقبال کرے گا ہماری تیاری مکمل ہے انشاء اللہ اہل گجرات کااستقبال مدتوں یاد رکھاجائے گا تقریب سے یاسرامین،انسپکٹر(ر) چوہدری بشیر ودیگرمقامی رہنماؤں نے بھی خطاب کیا۔","Superadmin",NULL,"گجرات","3","1","1","0",NULL,NULL,NULL,"2022-03-02 16:58:54","2022-03-02 16:58:54"
