"id","heading","images","description","reporter","town","city","reporter_id","featured","status","top_news","top_new_b1","top_new_b2","top_new_b3","created_at","updated_at"
"208","پنجاب کا بجٹ چیلنج بن گیا، گورنر نے ایوان اقبال، سپیکر نے اسمبلی ہال میں اجلاس بلا لیا","[""Gh8wcwaXhe.jpg""]","نجاب میں بجٹ پیش کرنا چیلنج بن گیا، گورنر نے بجٹ اجلاس ایوان اقبال میں طلب کرلیا، جبکہ سپیکر پرویز الہی نے اجلاس اسمبلی ہال میں بلا لیا۔

دو روز سے پنجاب حکومت اسمبلی میں آئندہ مالی سال کا بجٹ پیش نہیں کرسکی، گورنر پنجاب نے بجٹ اجلاس ایوان اقبال میں طلب کرلیا جبکہ اسپیکر کے مطابق اجلاس اسمبلی ہال میں ہی ہو گا۔ گزشتہ روز گورنر پنجاب محمد بلیغ الرحمان نے پنجاب اسمبلی کا 40 واں اجلاس برخاست کر دیا تھا جبکہ اسمبلی کا 41 واں اجلاس آج ایوان اقبال طلب کر رکھا ہے۔

دوسری جانب سپیکر چودھری پرویز الہی کا کہنا ہے کہ گورنر کا سیشن برخاست کرنے کا اختیار ختم ہوچکا،اجلاس کی کارروائی اسمبلی ہال میں ہی ہوگی۔ انہوں نے کہا ہے اسپیکر کے ہوتے ہوئے ڈپٹی اسپیکر کارروائی نہیں چلا سکتا، اجلاس بلانے کا طریقہ کار طے ہے، سیشن بلانے کیلئے گورنر سیکرٹری اسمبلی کو لکھے گا، انہوں نے پہلے غلط الیکشن کرایا آج دوسرا بد نما داغ اپنے ماتھے پر لگا لیا۔

سابق وزیر قانون اور پی ٹی آئی رہنما راجہ بشارت کا کہنا تھا حکومت کو غیرآئینی اقدام نہیں اٹھانے دیں گے، سبطین خان اور میاں اسلم اقبال نے کہا کسی اور عمارت میں اجلاس بلایا نہیں جاسکتا۔

ادھر صوبائی وزیر اور ن لیگی رہنما عطا تارڑ نے کہا ہے کہ گورنر نے آئینی ذمہ داری نبھاتے ہوئے اجلاس طلب کیا، اپوزیشن کو عوام کی پرواہ نہیں۔اویس لغاری کا کہنا تھا آئین پانی کی طرح ہوتا ہے، اپنا راستہ خود نکالتا ہے، ہم عوام کو جوابدہ ہیں","یاورعباس",NULL,"کنجاہ","15","0","1","0",NULL,NULL,NULL,"2022-06-15 20:06:38","2022-10-07 19:36:22"
"209","ملک میں بجلی کا بحران برقرار، شارٹ فال 6 ہزار 666 میگاواٹ سے تجاوز کر گیا","[""mrAYmAjVfe.jpg""]","ملک میں بجلی کا بحران تاحال برقرار، بجلی کا شارٹ فال چھ ہزار چھ سو چھیاسٹھ میگاواٹ سے زائد ہے، شارٹ فال کے باعث شدید گرمی میں چودہ گھنٹے تک کی لوڈشیڈنگ جاری ہے۔

ذرائع کے مطابق بجلی کی مجموعی پیداوار 21 ہزار 234 میگا واٹ اور کل طلب 27 ہزار 900 میگا واٹ ہے۔ ذرائع کے مطابق پانی سے 4 ہزار 744 میگا واٹ، سرکاری تھرمل پلانٹس 1 ہزار707 میگا واٹ اور نجی شعبے کے بجلی گھروں کی مجموعی پیداوار 12 ہزار 303 میگاواٹ سے زائد ہے، ونڈ پاور پلانٹس 1ہزار 961 میگاواٹ اور سولر پلانٹس سے 110 اور بگاس سے چلنے والے پلانٹس 174 میگاواٹ بجلی پیدا کررہے ہیں ،جوہری ایندھن سے 1ہزار 236 میگاواٹ بجلی پیدا کی جارہی ہے۔

ذرائع کے مطابق ملک کے مختلف علاقوں میں 14 گھنٹے تک کی لوڈشیڈنگ کی جارہی ہے۔ اسلام آباد ریجن میں بھی 6 سے 8 گھنٹے تک لوڈ شیڈنگ جاری ہے جبکہ دیہات اور زیادہ نقصانات والے علاقوں میں لوڈشیڈنگ کا دورانیہ اس سے زیادہ ہے۔","فیصل گجر","کوٹلہ",NULL,"17","0","1","1",NULL,NULL,NULL,"2022-06-15 20:09:52","2022-10-14 19:36:23"
"210","ملک میں آج سے پری مون سون کا آغاز، پنجاب اور خیبرپی کے میں بادل برسیں گے","[""fwfwM936EZ.jpg""]","ملک میں آج سے پری مون سون کا آغاز ہو گا، بالائی پنجاب، بالائی خیبرپختونخوا میں بادل برسیں گے، کشمیر اور گلگت بلتستان میں بھی بارش کا امکان ہے۔

شدید گرمی کے بعد موسم کا حال بتانے والوں نے بارشوں کی نوید سنا دی، پنجاب میں آج لاہور، گوجرانوالہ، سیالکوٹ اور دیگر علاقوں میں بادل برسنے کا امکان ہے، بالائی خیبرپختونخوا کے مختلف علاقوں میں بھی بارش کی پیشگوئی ہے۔

اسلام آباد میں شام کو بارش کی توقع ہے، بلوچستان میں موسم گرم اور خشک رہے گا۔","فیصل گجر","کوٹلہ",NULL,"17","0","1","1",NULL,NULL,NULL,"2022-06-15 20:10:43","2022-10-14 19:36:23"
"211","جوہری ممالک نے گزشتہ برس ایٹمی ہتھیاروں پر 82.4 ارب ڈالر خرچ کیے","[""1aVolTMkyr.jpg""]","جوہری ممالک نے سال 2021 میں نیوکلیئر ہتھیاروں پر 82.4 ارب ڈالر خرچ کیے، امریکا نے سب سے زیادہ پیسہ بہایا۔

نیوکلیئر ہتھیاروں کے خاتمے کیلئے سرگرم عالمی تنظیم کی رپورٹ کے مطابق جوہری ممالک میں ہتھیاروں پر سب سے زیادہ رقم خرچ کرنے والے ممالک میں امریکا سرفہرست ہے۔ دوسرے نمبر پر چین اورروس کا فہرست میں تیسرانمبر ہے۔

برطانیہ، فرانس بالترتیب چوتھے اور پانچویں جبکہ بھارت کا فہرست میں چھٹا نمبر ہے۔ اسرائیل ساتویں، پاکستان آٹھویں اور شمالی کوریا نویں نمبر پر ہے۔","فیصل گجر","کوٹلہ",NULL,"17","0","1","1",NULL,NULL,NULL,"2022-06-15 20:12:34","2022-10-14 19:36:23"
"212","وزیراعظم نے پٹرولیم مصنوعات کی قیمتیں بڑھانے کی سمری مسترد کر دی","[""QmVTasVYFk.jpg""]","وزیراعظم شہباز شریف نے پٹرولیم مصنوعات کی قیمتیں بڑھانے کی سمری مسترد کر دی۔

ذرائع کے مطابق وزارت خزانہ نے کہا ہے کہ پٹرول کی 23 اور ڈیزل کی 53 روپے قیمت بڑھانے کا کوئی امکان نہیں۔ آج پٹرول مہنگا نہیں ہوگا، وزیر اعظم شہباز شریف نے پٹرولیم قیمتوں میں اضافے کی سمری آج مسترد کردی ہے۔ 

اس سے قبل پٹرولیم مصنوعات کی قیمتوں میں ایک بار پھر اضافے کی سمری حکومت کو ارسال کی تھی۔

آئل اینڈ گیس ریگولیٹری اتھارٹی (اوگرا) نے حکومت کو تجویز دی تھی کہ پٹرول 29 جبکہ ڈیزل 55 روپے فی لٹر مہنگا کیا جائے۔

واضح رہے کہ پٹرول کی موجودہ قیمت 209 روپے 86 پیسے، ڈیزل 204.15 روپے فی لٹر، لائٹ ڈیزل 178 روپے 03 پیسے جبکہ مٹی کا تیل 181.94 روپے فی لٹر میں دستیاب ہے۔

خیال رہے کہ 26 مئی اور دو جون کو مسلسل دو بار پٹرولیم مصنوعات کی قیمتوں میں 30 .30 روپے کا اضافہ کیا گیا تھا۔

پٹرول اور ڈیزل پر سبسڈی ختم نہ کی تو ملک دیوالیہ ہو جائے گا: مفتاح اسماعیل

دو روز قبل وفاقی وزیر خزانہ مفتاح اسماعیل نے خدشے کا اظہار کیا تھا کہ فیول ایڈجسٹمنٹ چارجز جون میں لگیں گے تو ایسا بل آئے گا اللہ معاف کرے، بجلی کا سرکلر ڈیٹ مزید بڑھا تو نظام بیٹھ جائے گا، اگر جولائی تک پٹرول اور ڈیزل پر سبسڈی ختم نہ کی تو ملک دیوالیہ ہو جائے گا۔

مفتاح اسماعیل نے گیس کی قیمتیں بڑھانے کا اشارہ دیتے ہوئے کہا کہ گیس کے محکمے میں بھی خسارے کا سامنا ہے، گیس کا سرکلر ڈیٹ 1500 ارب روپے کا ہوگیا ہے، گیس میں ابھی تھوڑی سی گنجائش ہے، چار ہزار کی گیس لے کر 500 روپے کی تو نہیں دے سکتے، ستر فیصد گھریلو صارفین کو 500 کے قریب بل آتا ہے۔

وفاقی وزیر کا کہنا تھا کہ بجلی کا سرکلر ڈیٹ مزید بڑھا تو نظام بیٹھ جائے گا، کوئلہ کی انٹرنیشنل قیمت 20 سال سے 50 ڈالر سے زائد نہیں تھی، اب کوئلہ کی انٹرنیشنل قیمت 300 ڈالر سے زائد ہے، اگر جولائی تک پٹرول اور ڈیزل پر سبسڈی ختم نہ کی تو ملک دیوالیہ ہو جائے گا، اگر پٹرول اور ڈیزل پر سبسڈی ختم نہ کی تو آئی ایم ایف سے معاہدہ نہیں ہوگا، بنگلا دیش کے زرمبادلہ کے ذخائر 40 ارب ڈالر سے زیادہ ہیں، نیپرا اب بھی 5 ماہ پرانی فیول کاسٹ پر بجلی کے ریٹ کے فیصلے کر رہا ہے۔

انہوں نے کہا کہ ہم نے بینکوں پر بھی ٹیکس بڑھا دیا ہے، آئی ایم ایف کے ساتھ انکم ٹیکس کے حوالے سے ڈسپیوٹ ہے، دس دن کے اندر 40 لاکھ لوگوں نے دو ہزار کے لیے میسج بھیجا ہے، کچھ دنوں تک ایکسپورٹ پالیسی کا اعلان کریں گے، سب سے زیادہ قرض عمران خان کی حکومت نے لیے، ملک مقروض ہوگیا ہے، ہماری مدد کریں۔","چوہدری شمشاد","کڑیانوالہ",NULL,"24","0","1","1",NULL,NULL,NULL,"2022-06-15 20:28:15","2022-11-04 19:35:06"
"213","پاکستان گرے لسٹ سے باہر نکلنے کیلئے ایک قدم دور ہے، حنا ربانی کھر","[""UxgdBHIrSJ.jpg""]","وزیر مملکت برائے امور خارجہ حنا ربانی کھر نے کہا ہے کہ پاکستان نے ایف اے ٹی ایف کے تمام ایکشن پلان پر عمل درآمد کیا، پاکستان گرے لسٹ سے باہر نکلنے کیلئے ایک قدم دور ہے۔

اسلام آباد میں پریس کانفرنس کرتے ہوئے وزیر مملکت برائے امور خارجہ حنا ربانی کھر کا کہنا تھا کہ انسداد منی لانڈرنگ اور دہشت گردوں کی مالی معاونت کے حوالے سے پاکستان کی جانب سے جامع اصلاحات پر عمل درآمد کیا گیا۔

انہوں نے کہا کہ یہ ہماری کوششوں کا نتیجہ ہے، پہلا ایکشن پلان بہت طویل تھا لیکن یہ ایکشن پلان ہم نے مقررہ وقت سے قبل پورا کرلیا اور اس کو ایف اے ٹی ایف کے تمام اراکین نے تسلیم کیا اور پاکستان کی تیز رفتار پیش رفت کو خوش آئند قرار دیا۔

ان کا کہنا تھا کہ ایف اے ٹی ایف اراکین نے تسلیم کیا کہ پاکستان نے اے ایم ایل اور سی ایف ٹی سے بہترین انداز میں مقابلہ کیا ہے جس کے نتیجے میں ہم نے دیکھا کہ ایف اے ٹی ایف نے متفقہ طور پر فیصلہ کیا کہ پاکستان تمام تر تکنیکی بینج مارک سے نمٹا اور 2018 اور 2021 میں دیئے گئے تمام ایکشن پلانز پر کامیابی سے عمل درآمد کیا۔","زاھد",NULL,"لالہ موسی","10","0","1","1",NULL,NULL,NULL,"2022-06-18 14:31:38","2022-10-07 18:30:56"
"214","پنجاب کے ضمنی انتخابات کے غیرحتمی، غیرسرکاری نتائج، پی ٹی آئی کو واضح برتری حاصل","[""e8sFbXsJFM.jpg""]","پاکستان تحریک انصاف (پی ٹی آئی) کے منحرف اراکین کے ڈی سیٹ ہونے سے خالی ہونے والی 20 نشستوں پر ضمنی انتخابات کے غیرحتمی اور غیرسرکاری نتائج آنے کا سلسلہ جاری ہے جہاں پی ٹی آئی کو مسلم لیگ (ن) پر واضح برتری حاصل ہے اور اب تک 15 نشستیں جیت لی ہیں۔

غیرسرکاری اور غیرحتمی نتائج کے مطابق پی پی- 167 لاہور میں پی ٹی آئی کے امیدوار کے شبیر گجر 40 ہزار 511 ووٹ لے کر کامیاب ہوئے جہاں مسلم لیگ (ن) کے ٹکٹ پر الیکشن لڑنے والے منحرف امیدوار نذیر چوہان 26 ہزار 472 ووٹ لے سکے۔

اسی طرح لاہور کے پی پی-158 میں بھی پی ٹی آئی کے میاں اکرم عثمان 37 ہزار 463 ووٹ حاصل کرکے جیت گئے۔","لیاقت قادری",NULL,"کھاریاں","23","0","1","0",NULL,NULL,NULL,"2022-07-18 15:03:16","2023-03-09 19:06:25"
"215","محکمہ ریلوے میں 'غیر مصدقہ ملازمین' کو 35 ارب روپے پینشن دینے کا انکشاف","[""ucDf2grRjv.jpg""]","منصوبہ بندی کمیشن کے تحت کام کرنے والے سرکاری تھنک ٹینک پاکستان انسٹی ٹیوٹ آف ڈیولپمنٹ اکنامکس (پی آئی ڈی ای) نے انکشاف کیا ہے کہ پاکستان ریلوے کے ایک لاکھ 15 ہزار غیر تصدیق شدہ ریٹائرڈ ملازمین کو سالانہ پینشن کی مد میں 35 ارب روپے ادا کیے جا رہے ہیں۔

ڈان اخبار کی رپورٹ کے مطابق گزشتہ روز جاری ہونے والے اپنے ایک بیان میں پی آئی ڈی ای نے بتایا کہ ان کی تحقیق سے ظاہر ہوتا ہے کہ 2015 سے 2020 تک کے 5 سال کے دوران وزارت ریلوے کو 144 ارب روپے کا بڑا مالی نقصان ہوا۔

پی آئی ڈی ای کی رپورٹ میں پاکستان ریلویز میں بنیادی ادارہ جاتی اصلاحات کی سفارش کی گئی ہے کیونکہ وزارت ریلوے پاکستان میں سب سے زیادہ خسارے میں چلنے والے 10 سرکاری اداروں میں شامل ہے۔","لیاقت قادری",NULL,"کھاریاں","23","0","1","1",NULL,NULL,NULL,"2022-07-18 15:05:29","2023-03-09 19:06:25"
"216","ریحام خان کا تیسری شادی کا عندیہ","[""m6V1g8CnV1.jpg""]","لکھاری اور صحافی ریحام خان نے تیسری بار رشتہ ازدواج میں بندھنے کا اشارہ دیتے ہوئے کہا ہے کہ اگر انہوں نے تیسری شادی کی تو ان کے ہونے والے شوہر کو سرپرائز ملے گا۔

ریحام خان کی دونوں شادیاں طلاق پر ختم ہوئی تھیں، انہوں نے پہلی شادی 1990 کے بعد کی تھی جو 2005 میں طلاق پر ختم ہوئی۔

انہیں پہلی شادی سے تین جواں سالہ بچے بھی ہیں جو کہ برطانیہ میں مقیم ہیں۔","لیاقت قادری",NULL,"کھاریاں","23","0","1","1",NULL,NULL,NULL,"2022-07-18 15:07:58","2023-03-09 19:06:25"
"217","امریکا نے عمران خان کے سازش کے دعووں کو پریشان کن قرار دے دیا","[""iQvqoAMTpB.jpg""]","پاکستان کے ساتھ دوبارہ ایک مضبوط شراکت داری استوار کرنے کی واشنگٹن کی خواہش اجاگر کرتے ہوئے امریکی محکمہ خارجہ کے ایک عہدیدار کا کہنا ہے کہ سابق وزیراعظم عمران خان کے سازشی دعوے 'انتہائی پریشان کن' ہیں۔

ڈان اخبار کی رپورٹ کے مطابق اٹلانٹک سٹی، نیو جرسی میں پاکستانی معالجین کے کنونشن سے خطاب کرتے ہوئے ڈائریکٹر پاکستان ڈیسک نیل ڈبلیو ہاپ نے پاکستان اور امریکا کے تعلقات کو ایک ایسی شراکت داری کے طور پر بیان کیا 'جس کے بغیر ہم نہیں کر سکتے'۔

انہوں نے کہا کہ ہمیں عالمی معاملات سے نمٹنے کے لیے پاکستان کے ساتھ مل کر کام کرنا ہے۔ یہ ایک شراکت داری ہے جو ہمارے لیے ضروری ہے۔","لیاقت قادری",NULL,"کھاریاں","23","0","1","0",NULL,NULL,NULL,"2022-07-18 15:15:46","2023-03-09 19:06:25"
"218","پنجاب کے ضمنی انتخابات میں پی ٹی آئی 15، مسلم لیگ ن 4 نشستوں پر کامیاب","[""BM214ovmtT.jpg""]","لاہور: پنجاب میں صوبائی اسمبلی کی 20 نشستوں پر ہونے والے ضمنی انتخابات میں پاکستان تحریک انصاف 15، مسلم لیگ ن چار جبکہ ایک نشست پر آزاد امیدوار کامیاب ہوئے۔

الیکشن کمیشن کو آر ٹی ایس سسٹم کے ذریعے موصول ہونے والے نتائج کے مطابق پاکستان تحریک انصاف جھنگ کی دو، لاہور کی تین اور ملتان، راولپنڈی، مظفر گڑھ، ڈیرہ غازی خان، ساہیوال، خوشاب، بھکر، شیخوپورہ، فیصل آباد، لودھراں سے ایک ایک نشست پر کامیاب ہوگئی۔","عبدالستارمرزا",NULL,"گجرات","14","1","1","0",NULL,NULL,NULL,"2022-07-18 15:19:40","2022-07-18 15:19:40"
"219","مشکل فیصلوں کا نقصان (ن) لیگ کو ہوا ہے، نواز شریف","[""X1sS3WpPqk.jpg""]","مسلم لیگ (ن) کے قائد نواز شریف نے پنجاب کے ضمنی انتخابات میں ن لیگ امیدواروں کی شکست کے بعد کہا ہے کہ مشکل فیصلوں کا نقصان مسلم لیگ (ن) کو ہوا ہے۔ 

ذرائع کے مطابق نواز شریف نے وزیر اعظم شہباز شریف اور وزیر اعلیٰ حمزہ شہباز سے رابطہ کیا اور ضمنی انتخابات کے نتائج کے تناظر میں آئندہ کے لائحہ عمل پر بات چیت کرتے ہوئے پارٹی کا ہنگامی اجلاس طلب کرنے کی ہدایت کردی۔

پارٹی ذرائع کے مطابق نواز شریف کا کہنا تھا کہ مشکل فیصلوں کا نقصان ن لیگ کو ہوا ہے۔ پارٹی کے قائد کا یہ بھی کہنا تھا کہ ہم عوام کی رائے کا احترام کرتے ہیں اور ابھی انتخابی نتائج آ رہے ہیں۔
دوسری جانب نواز شریف نے شہباز شریف کو ہنگامی اجلاس طلب کرنے کی ہدایت کی۔ نواز شریف نے کہا کہ واضع نتائج آنے کے بعد ہنگامی اجلاس میں آئندہ مرحلے کا لائحہ عمل طے کیا جائے گا۔","زاھد",NULL,"لالہ موسی","10","0","1","0",NULL,NULL,NULL,"2022-07-18 15:27:01","2022-10-07 18:30:56"
"220","فیس بک کا ایک ہی فرد کو 5 پروفائل بنانے کی اجازت دینے کا فیچر","[""IBwQKYqceL.jpg""]","دنیا کی سب سے بڑی سوشل ویب سائٹ فیس بک نے اعلان کیا ہے کہ وہ جلد ہی ایسا فیچر متعارف کرائے گی، جس سے کوئی بھی فرد بیک وقت کم از کم اپنے 5 مختلف پروفائل بنانے کے قابل ہوجائے گا۔

اس وقت فیس بک پر کوئی بھی فرد اپنے اصل نام سے صرف ایک ہی پروفائل اکاؤنٹ بنا سکتا ہے، تاہم وہ جعلی ناموں سے کئی اکاؤنٹ بنا سکتا ہے۔

اس وقت کوئی بھی فرد اپنے اصل نام کے ساتھ ایک اکاؤنٹ کے علاوہ مختلف ناموں کے متعدد اکاؤنٹس اور پیجز بھی بنا سکتا ہے۔

تاہم نئے فیچر کے بعد ایک ہی شخص اپنے اصل نام سے کم از کم 5 پروفائل بنانے کا اہل ہوجائے گا۔","شیخ مظفر","بھاگووال",NULL,"21","0","1","0",NULL,NULL,NULL,"2022-07-18 16:19:36","2022-11-21 17:25:28"
"221","سری لنکا: نئے صدر کے لیے پارلیمنٹ میں ووٹنگ سے قبل ایمرجنسی نافذ","[""7BJMvFDyF2.jpg""]","سری لنکا کے قائم مقام صدر رانیل وکرماسنگھے نے رات گئے سیاسی و معاشی بحران سے متاثرہ جزیرہ نما ملک میں ایمرجنسی نافذ کرنے کے احکامات جاری کردیے۔

غیر ملکی خبر رساں ادارے 'رائٹرز' کی رپورٹ کے مطابق ملک میں ہنگامی حالات کے نفاذ کا مقصد اس ہفتے کے آخر میں نئے صدر کے انتخاب کے لیے پارلیمان میں ہونے والی ووٹنگ سے قبل بدامنی کو روکنا اور امن و امان کی صورتحال کو قابو میں رکھنا ہے۔

سری لنکا کے مشکل صورتحال سے دوچار رہنماؤں نے اپریل کے بعد سے اب تک کئی مرتبہ ملک میں ہنگامی حالت نافذ کی ہے جبکہ حکومت کی جانب سے شدید معاشی بحران اور اشیائے ضروریہ کی مسلسل قلت سے نمٹنے میں ناکامی کے خلاف عوامی مظاہروں نے شدت اختیار کرلی تھی۔","عمران گلیانہ","گلیانہ",NULL,"19","0","1","0",NULL,NULL,NULL,"2022-07-18 16:36:10","2022-11-04 19:49:05"
"222","ایران جوہری بم بنانے کی صلاحیت رکھتا ہے، خامنائی کے مشیر کا دعویٰ","[""CS148O77Cy.jpg""]","ایران کے سپریم لیڈر آیت اللہ علی خامنہ ای کے ایک سینئر مشیر نے اتوار کو قطر کے الجزیرہ ٹی وی کو بتایا کہ ایران تکنیکی طور پر جوہری بم بنانے کی صلاحیت رکھتا ہے لیکن اس نے یہ فیصلہ نہیں کیا کہ اسے بنایا جائے یا نہیں۔

ڈان اخبار میں شائع خبر رساں ایجنسی رائٹرز کی رپورٹ کے مطابق کمال خرازی نے یہ بات ایک ایسے موقع پر کی جب ایک دن قبل امریکی صدر جو بائیڈن نے اسرائیل اور سعودی عرب کے اپنے چار روزہ دورے کے اختتام پر ایران کو 'جوہری ہتھیاروں کے حصول' سے روکنے کے عزم کا اظہار کیا۔","عمران گلیانہ","گلیانہ",NULL,"19","0","1","1",NULL,NULL,NULL,"2022-07-18 16:41:05","2022-11-04 19:49:05"
"223","پاکستان کے ساتھ دوبارہ ایک مضبوط شراکت داری استوار کرنے کی واشنگٹن کی خواہش اجاگر کرتے ہوئے امریکی محکمہ خارجہ کے ایک عہدیدار کا کہنا ہے کہ سابق وزیر اعظم عمران خان کے سازشی دعوے 'انتہائی پریشان کن' ہیں۔","[""x9lOlsUrOk.jpg""]","اٹلانٹک سٹی، نیو جرسی میں پاکستانی معالجین کے کنونشن سے خطاب کرتے ہوئے ڈائریکٹر پاکستان ڈیسک نیل ڈبلیو ہاپ نے پاکستان اور امریکا کے تعلقات کو ایک ایسی شراکت داری کے طور پر بیان کیا 'جس کے بغیر ہم نہیں کر سکتے'۔

انہوں نے کہا کہ ہمیں عالمی معاملات سے نمٹنے کے لیے پاکستان کے ساتھ مل کر کام کرنا ہے، یہ ایک شراکت داری ہے جو ہمارے لیے ضروری ہے۔","چوہدری شمشاد","کڑیانوالہ",NULL,"24","0","1","0",NULL,NULL,NULL,"2022-07-18 17:07:36","2022-11-04 19:35:06"
"224","جنوب مغربی یورپ مسلسل چھٹے روز ہیٹ ویو کی لپیٹ میں رہا جس سے جنگلات میں تباہ کن آگ بھڑک اٹھی اور براعظم کے کچھ حصوں میں انتہائی بلند درجہ حرارت ریکارڈ کیا گیا۔","[""uOrA2Ump8K.jpg""]","فرانس، پرتگال اور اسپین کے ساتھ ساتھ یونان میں فائر فائٹرز جنگل کی آگ سے لڑ رہے ہیں، جس سے ہفتے کے آغاز سے ہی ہزاروں ہیکٹر اراضی تباہ اور کئی فائر فائٹرز ہلاک ہوگئے۔

جنوب مغربی فرانس کے گیروندے علاقے میں آرکاچون کے ایک اہلکار رونن لیوسٹک نے کہا کہ 'آگ اب تک قابو میں نہیں آئی'، اس علاقے کے فائر فائٹرز جنگل میں لگی دو آگ بجھانے کے لیے کوششیں کیں جس نے منگل سے اب تک 9 ہزار ہیکٹر (22 ہزار 200 ایکڑ) کو اپنی لپیٹ میں لے لیا۔","فیصل گجر","کوٹلہ",NULL,"17","0","1","0",NULL,NULL,NULL,"2022-07-18 17:13:26","2022-10-14 19:36:23"
