"id","heading","images","description","reporter","town","city","reporter_id","featured","status","top_news","top_new_b1","top_new_b2","top_new_b3","created_at","updated_at"
"143","آئل اینڈ گیس ریگولیٹری اتھارٹی (اوگرا) نے گیس کی قلت کے پیش نظر 2 گیس کمپنیوں کے سروس نیٹ ورک میں ناقابل عمل گیسیفکیشن اسکیموں پر تشویش کا اظہار کیا ہے۔","[""uhuVO0itgw.jpg""]","مالی سال 22-2021 کے لیے تخمینہ آمدنی کی ضرورت کے جائزے میں اتھارٹی نے کہا کہ لاہور میں قائم سوئی ناردرن گیس پائپ لائنز لمیٹڈ (ایس این جی پی ایل) نے 12 لاکھ نئے گھریلو کنکشن کی فراہمی کے لیے سروس لائنوں کے لیے 10 ارب 24 کروڑ روپے کا تخمینہ لگایا تھا۔

تاہم اب کمپنی کی جانب سے بجٹ کی رقم کے ساتھ اہداف پر نظرثانی کی گئی ہے اور اس کے مطابق اتھارٹی سے 3 لاکھ گھریلو کنکشن کے لیے 2 ارب 56 کروڑ روپے پر غور کرنے کی درخواست کی گئی ہے۔کمپنی نے کہا کہ زیر التوا درخواستوں کی بڑی تعداد (تقریباً 30 لاکھ) کو مدنظر رکھتے ہوئے درخواست کے وقت 12 لاکھ کنکشن تجویز کیے گئے تھے، لیکن سسٹم گیس کی محدود دستیابی کی وجہ سے 3 لاکھ نئے گیس کنکشن ان علاقوں میں فراہم کرنے کی درخواست کی گئی جہاں پہلے سے گیس اور گیس کنکشن نیٹ ورک موجود تھے۔

اتھارٹی نے یہ بھی دعویٰ کیا کہ پچھلے 5 سالوں کے دوران اوسطاً ہر سال 4 لاکھ سے زائد نئے گھریلو کنکشن لگائے گئے۔

اس میں کہا گیا کہ گیس کنکشن کے نئے اہداف میں اس حقیقت کو مدنظر رکھتے ہوئے نظر ثانی کی گئی ہے کہ مالی سال کے پہلے 3 مہینے بجٹ کو حتمی شکل دینے میں گزر گئے اور بقیہ وقت پہلے کے مجوزہ ہدف کو حاصل کرنے کے لیے کافی نہیں تھا جس کی بڑی وجہ مطلوبہ مواد کی محدود دستیابی ہےریگولیٹر نے نوٹ کیا کہ سال بھر کے لیے نئے کنکشنز کا ہدف بغیر کوئی ٹھوس وجہ بتائے اصل پٹیشن کے وقت پیش کیے گئے اعداد و شمار کے ایک چوتھائی تک کم کر دیا گیا۔

مزید برآں کمپنی نے ایسے مبالغہ آمیز اعداد و شمار پیش کرتے ہوئے اپنی مادی اور مالی صلاحیت کا درست اندازہ نہیں لگایا جس کا مالیاتی اثر براہ راست صارفین پر پڑا۔

اتھارٹی نے کہا کہ بغیر کسی ٹھوس وجوہات کے اہداف پر نظرثانی اس معیار پر مزید سوال اٹھاتی ہے جس کے مطابق درخواست گزار کی جانب سے نئے گیس کنکشن کے لیے سیٹنگ، پلاننگ اور بجٹنگ کی جاتی ہے، سسٹم میں پریشر میں کمی اور گیس کی سپلائی میں رکاوٹ کی مسلسل اطلاعات موصول ہوتی رہیں اور موسم سرما کے مہینوں میں صورتحال مزید خراب ہو جاتی ہے۔وگرا نے کہا کہ اس نے بار بار 'ایس این جی پی ایل' سے کہا ہے کہ وہ ایسے مسائل کو ترجیحی بنیادوں پر حل کرے اور اپنے نیٹ ورک کی ترقی کی منصوبہ بندی منظم انداز میں کرے تاکہ اس طرح کے حالات سے موجودہ صارفین پر منفی اثر نہ پڑے، تاہم درخواست گزار نے ان مسائل کو حل کرنے پر کوئی توجہ نہیں دی۔

لہٰذا ملک میں موجودہ توانائی کے بحران کو مدنظر رکھتے ہوئے اور تمام پہلوؤں پر غور کرتے ہوئے اتھارٹی نے گیس کی تقسیم کے ترقیاتی منصوبوں پر عمل درآمد کے لیے ایک مناسب فریم ورک وضع کیا اور ساتھ ہی قانونی پوزیشن کے مطابق موجودہ اور ممکنہ صارفین کو نئے گیس کنکشنز کی فراہمی کے لیے توانائی کی پائیداری اور تحفظ کو یقینی بنایا۔

سوئی سدرن گیس کمپنی لمیٹڈ (ایس ایس جی سی ایل) کے حوالے سے اوگرا نے کہا کہ کمپنی نے ایک کروڑ 33 لاکھ 976 گیس کنکشنز کے لیے ایک ارب 33 کروڑ 60 لاکھ روپے کا تخمینہ لگایا تھا جس میں سے اوگرا نے صنعتی اور کمرشل صارفین کو آر ایل این جی پر صرف 24 کروڑ 30 روپے کی اجازت دی۔","Superadmin",NULL,"جلالپور جٹاں","3","0","1","0",NULL,NULL,NULL,"2022-03-09 18:31:11","2022-03-09 18:31:11"
"144","اپوزیشن کو حکومتی اتحاد ’چند روز‘ میں ٹوٹ جانے کی امید","[""xJEvN9MfDI.png""]","اپوزیشن جماعتوں کے پی ٹی آئی حکومت کے اتحادیوں کے ساتھ مذاکرات ’حتمی مرحلے‘ میں داخل ہو چکے ہیں، مشترکہ اپوزیشن کو امید ہے کہ حکمران اتحاد ’گھنٹوں نہیں تو چند دنوں میں‘ ٹوٹ جائے گا۔

ڈان اخبار کی رپورٹ کے مطابق وزیر داخلہ شیخ رشید احمد اور وفاقی وزیر برائے آبی وسائل مونس الٰہی کے درمیان سخت جملوں کے تبادلے سے بھی مخلوط حکومت میں دراڑیں بھی نظر آئیں۔

شیخ رشید احمد نے مسلم لیگ (ق) الزام عائد کیا کہ وہ اپوزیشن کی جانب سے وزیراعظم عمران خان کے خلاف تحریک عدم اعتماد کے اقدام کے خلاف ساتھ دینے کے لیے حکومت کو بلیک میل کررہی ہے۔","Superadmin",NULL,"گجرات","3","1","1","0",NULL,NULL,NULL,"2022-03-13 17:26:44","2022-03-13 17:26:44"
"145","پاکستان تحریک انصاف (پی ٹی آئی) کے منحرف رہنما علیم خان کی لندن میں مسلم لیگ (ن) کے صدر میاں نواز شریف سے ملاقات کے ایک روز بعد 
جہانگیر ترین گروپ کے ناراض اراکین غلط فہمیاں دور کرنے کے لیے ان سے ملنے جا پہنچے۔","[""apJ0aAZOkG.jpg""]","ڈان اخبار کی رپورٹ کے مطابق دونوں گروپوں کے درمیان ملاقات اس پس منظر میں ہوئی جب علیم خان، جہانگیر ترین کی عیادت کے بغیر لندن سے واپس آ گئے اور ترین گروپ کے ارکان نے کہا کہ وہ علیم خان کو پنجاب کی وزارت اعلیٰ کے عہدے کے امیدوار کے طور پر قبول نہیں کریں گے۔

ترین گروپ کے مرکزی رہنماؤں سعید اکبر نوانی اور عون چوہدری نے علیم خان سے علیحدہ علیحدہ ملاقات کی اور حکمران جماعت پی ٹی آئی میں دونوں گروپوں کے کردار پر تبادلہ خیال کیا۔

دورہ کرنے والے رہنماؤں نے مشورہ دیا کہ دونوں گروپوں کو پی ٹی آئی کو ٹف ٹائم دینے پر توجہ مرکوز رکھنی چاہیے جس نے مرکز اور پنجاب میں اپنے ساڑھے 3 سالہ دور حکومت میں جہانگیر ترین اور علیم خان جیسے سینئر رہنماؤں کے ساتھ ناروا سلوک کیا۔","Superadmin",NULL,"جلالپور جٹاں","3","1","1","0",NULL,NULL,NULL,"2022-03-13 17:28:06","2022-03-13 17:28:06"
"146","وفاقی وزیر داخلہ شیخ رشید احمد نے کہا ہے کہ جو وزیراعظم عمران خان کے ساتھ کھڑا ہوگا، اللہ بھی اسے عزت دے گا اور قوم بھی اسے عزت دے گی، ہم چٹان کی طرح اس کے ساتھ کھڑے ہیں۔","[""Ysqw0VCDvp.jpg""]","اسلام آباد میں ایک تقریب سے خطاب کرتے ہوئے شیخ رشید کا کہنا تھا کہ 15 تاریخ کے بعد عمران خان کی پوزیشن مزید واضح ہوجائے گی۔

انہوں نے کہا کہ اسپیکر اسد قیصر15 مارچ کے بعد فیصلہ کریں گے کہ قومی اسمبلی کا اجلاس کس روز بلایا جائے، 21 اور 22 مارچ کو او آئی سی کی کانفرنس ہے۔","Superadmin",NULL,"لالہ موسی","3","1","1","0",NULL,NULL,NULL,"2022-03-13 17:29:46","2022-03-13 17:29:46"
"147","پاکستان تحریک انصاف کی وفاقی حکومت نے آئین کے آرٹیکل 63-اے کی تشریح کے لیے سپریم کورٹ سےرجوع کرنے کا فیصلہ کرلیا۔","[""T2Hh27ZtaT.jpg""]","وفاقی وزیر اطلاعات و نشریات فواد چوہدری نے ٹوئٹر پر جاری پیغام میں بتایا کہ حکومت نے فیصلہ کیا ہے کہ آرٹیکل 63اے کی تشریح کے لیے سپریم کورٹ میں آرٹیکل 186 کے تحت ریفرنس دائر کیا جائے گا۔

ان کا کہنا تھا کہ سپریم کورٹ سے رائے مانگی جائے گی کہ جب ایک پارٹی کے اراکین واضح طور پر ہارس ٹریڈنگ میں ملوث ہوں اور پیسوں کے بدلے وفاداریاں تبدیل کریں تو ان کے ووٹ کی قانونی حیثیت کیا ہے۔","Superadmin",NULL,"گجرات","3","0","1","0",NULL,NULL,NULL,"2022-03-18 19:07:10","2022-03-18 19:07:10"
"148","اسلام آباد ہائی کورٹ نے الیکشن کمیشن آف پاکستان (ای سی پی) کو انتخابی ضابطہ اخلاق کی خلاف ورزی پر وزیراعظم عمران خان کے خلاف کارروائی سے روکنے کی استدعا مسترد کرتے ہوئے ای سی پی سے 28 مارچ تک جواب طلب کرلیا۔","[""gbmIC1aQeg.jpg""]","چیف جسٹس اطہر من اللہ کی عدم دستیابی پر جسٹس عامر فاروق نے وزیراعظم عمران خان اور وفاقی وزیر اسد عمر کی درخواست پر سماعت کی جس میں الیکشن کمیشن کے آرڈر اور نوٹسز کو چیلنج کیا گیا تھا۔

درخواست گزاروں کی جانب سے بیرسٹر علی ظفر عدالت میں پیش ہوئے اور دلائل دیے۔

بیرسٹر علی ظفر نے استدعا کی کہ عدالت آئندہ سماعت تک الیکشن کمیشن کو عمران خان کے خلاف کارروائی سے روکے۔","Superadmin",NULL,"گجرات","3","0","1","0",NULL,NULL,NULL,"2022-03-18 19:09:18","2022-03-18 19:09:18"
"149","شہباز شریف کی مائنس تحریک انصاف قومی حکومت کی تجویز، آئینی تصور یا نظریہ ضرورت","[""9fWGMR5BT2.JPG""]","پاکستان کے آئین میں قومی حکومت کا کوئی تصور موجود نہیں ہے۔ قومی حکومت درحقیقت ایک سیاسی اصطلاح ہے، یہ کوئی قانونی یا دستوری اصطلاح نہیں ہے۔‘

پاکستان میں آئینی اور پارلیمانی اُمور کے ماہر احمد بلال محبوب نے مسلم لیگ (ن) کے صدر شہباز شریف کے بیان پر تبصرہ کرتے ہوئے کہا ہے کہ پاکستان کے آئین میں ’قومی حکومت‘ کی کوئی گنجائش نہیں ہے لیکن اگر اس کی سیاسی تشریح کے مطابق چلا جائے تو اس کا مطلب ہے کہ تمام سیاسی جماعتوں پر مشتمل ایک ایسی حکومت بنائی جائے جسے پوری قوم کی حمایت حاصل ہو تاکہ درپیش مسائل کے حل کے لیے بڑے اور بنیادی فیصلے کیے جا سکیں۔

یاد رہے کہ دو روز قبل قومی اسمبلی میں اپوزیشن لیڈر اور صدر مسلم لیگ ن شہباز شریف نے تجویز دی تھی کہ اگر وزیر اعظم عمران خان کے خلاف تحریک عدم اعتماد کامیاب ہوئی تو پاکستان تحریک انصاف کو شامل کیے بغیر پانچ سال کے لیے قومی حکومت قائم کی جا سکتی ہے۔ ان کا کہنا تھا کہ ’ایک قومی حکومت بنانی ہو گی جو پانچ سال مل کر، سر جوڑ کر، ملکی مسائل حل کرے۔ اس کے بعد ایک سٹیج سیٹ ہو جائے گا۔‘

لیکن شہباز شریف کی تجویز کے مطابق اس قومی حکومت میں پاکستان تحریکِ انصاف شامل نہیں ہو گی، تو پھر یہ قومی حکومت کیسے ہوئی؟","Superadmin","منگووال",NULL,"3","0","1","0",NULL,NULL,NULL,"2022-03-18 19:12:37","2022-03-18 19:12:37"
"150","تحریک عدم اعتماد: صدارتی ریفرنس میں سپریم کورٹ سے کیا رائے مانگی گئی ہے؟","[""TljZt6OQ9Y.JPG""]","پاکستان کے وزیراعظم عمران خان کے خلاف تحریک عدم اعتماد پر باقاعدہ کارروائی شروع ہونے سے قبل صدر عارف علوی نے پارٹی سے منحرف اراکین کے ووٹ کی حیثیت جاننے کے لیے سپریم کورٹ کو ریفرنس بھیج دیا ہے۔

یہ صدارتی ریفرنس وزیراعظم عمران خان کے مشورے پر بھیجا گیا ہے، جس کی بنیاد تحریک انصاف کے سربراہ کی طرف سے ایسے 14 اراکین کو شوکاز نوٹس ہے، جس میں ان سے پارٹی سے انحراف سے متعلق وضاحت طلب کی گئی ہے۔

صدر عارف علوی نے بھی اپنے ٹوئٹر پیغام میں کہا ہے کہ ’ریفرنس کچھ ممبران پارلیمنٹ کے انحراف کی خبروں، ملک کے موجودہ حالات کے پیش نظر فائل کیا گیا ہے۔‘

واضح رہے کہ تحریک انصاف کے ان اراکین نے اپوزیشن کی طرف سے وزیر اعظم کے خلاف تحریک عدم اعتماد پر عمران خان کے خلاف ووٹ دینے کا اعلان کر رکھا ہے۔","Superadmin",NULL,"گجرات","3","1","1","0",NULL,NULL,NULL,"2022-03-21 16:29:42","2022-03-21 16:29:42"
"151","روس یوکرین تنازع: صدر پوتن کیا سوچ رہے ہیں، مغربی انٹیلیجنس کے لیے یہی سب سے اہم سوال بن گیا ہے","[""khkfLZwTpb.JPG""]","مغربی جاسوسوں کا خیال ہے کہ روس کے صدر ولادیمیر پوتن اپنی ہی بنائی ہوئی ایک خیالی دنیا میں قید ہیں۔ اور یہ بات ہی انھیں پریشان کرتی ہے۔

یہ مغربی جاسوس برسوں سے یہ جاننے کی کوشش میں ہیں کہ روسی صدر کے دماغ میں کیا چل رہا ہے تاکہ وہ بہتر طور پر ان کے ارادے بھانپ سکیں۔

بظاہر روسی فوجیوں کے یوکرین میں ’پھنس جانے‘ کے بعد ان کے لیے یہ جاننے کی ضرورت پہلے سے بھی زیادہ بڑھ گئی ہے کیونکہ وہ یہ جاننے کی کوشش میں ہیں کہ ایسی صورتحال میں روسی صدر کیا ردعمل دے سکتے ہیں۔

ان کی سوچ اور ذہن کو سمجھنا روس یوکرین تنازع کے بحران کو مزید خطرناک اور سنگین ہونے سے بچنے کے لیے بہت ضروری ہو گا۔","Superadmin","دولت نگر",NULL,"3","0","1","0",NULL,NULL,NULL,"2022-03-21 16:34:47","2022-03-21 16:34:47"
"152","یوکرین روس تنازع: روسی فوج نے یوکرین حملے میں کون سی غلطیاں کیں؟","[""Mgger81ot1.JPG""]","روس کی فوج دنیا کی بڑی اور طاقتور مسلح فوج میں سے ایک ہے لیکن یہ یوکرین پر اس کے ابتدائی حملے میں ثابت نہیں ہوا۔ بہت سے مغربی عسکری تجزیہ کار میدان جنگ میں اس کی اب تک کی کارکردگی پر حیران ہیں، جن میں سے ایک نے اسے 'مایوس کن' قرار دیا ہے۔

ایسا لگتا ہے کہ اس کی فوجی پیش قدمی بڑی حد تک رک گئی ہے اور کچھ ماہرین اب سوال اٹھاتے ہیں کہ کیا وہ اس نقصان کا ازالہ کر سکتا ہے جو اسے اس جنگ کے نتیجے میں اٹھانا پڑا ہے۔

رواں ہفتے، نیٹو کے ایک سینئر فوجی اہلکار نے بی بی سی کو بتایا کہ 'روسی فوج واضح طور پر اپنے مقاصد حاصل نہیں کر سکی اور شاید وہ مقاصد حاصل ہو بھی نہ سکیں۔'

تو روسی فوج نے کہاں غلطیاں کیں؟ اس سلسلے میں، میں نے سینئر مغربی فوجی افسران اور انٹیلی جنس حکام سے روس کی غلطیوں کے بارے میں بات کی۔","Superadmin",NULL,"لالہ موسی","3","1","1","0",NULL,NULL,NULL,"2022-03-21 16:38:59","2022-03-21 16:38:59"
"153","کورونا وائرس اور اومیکرون: کووڈ سے متاثرہ شخص کتنے دن تک متعدی رہتا ہے؟","[""LNbcUEqyef.JPG""]","کورونا وائرس کی اومیکرون قسم بہت تیزی سے دنیا میں پھیل رہی ہے اور اس نے دنیا بھر میں حکومتوں کو اس وبا سے نمٹنے کے لیے اپنی حکمت عمل تبدیل کرنے پر مجبور کر دیا ہے۔

اومیکرون وائرس دوسرے وائرس کے مقابلے میں زیادہ متعدی ہے جس میں ویکسین سے بچانے اور دوسرے لوگوں تک پھیلنے کی زیادہ صلاحیت پائی جاتی ہے۔

اومیکرون وائرس سے متاثرہ افراد کی تعداد میں اضافہ ہوا ہے لیکن ہسپتال میں داخل ہونے والوں کی تعداد نسبتاً کم رہی ہے۔

اس بات کے شواہد موجود ہیں کہ جن افراد کو ویکسین کے دو ٹیکے لگ چکے ہیں یا جن کو بوسٹر ملا ہے اگر وہ اس وائرس کا شکار ہو جاتے ہیں تو ان کے ہسپتال میں داخل ہونے یا مرنے کا امکان کم ہوتا ہے۔","Superadmin",NULL,"کھاریاں","3","1","1","0",NULL,NULL,NULL,"2022-03-21 16:42:54","2022-03-21 16:42:54"
"154","امریکہ کا پہلا ایٹمی تجربہ: ’دس بہن، بھائیوں میں سے صرف میں زندہ بچی، باقی سب کینسر سے مر گئے‘","[""oJXaLzDWup.JPG""]","16 جولائی سنہ 1945 کی صبح معمول کے مطابق امریکہ سے تعلق رکھنے والے ڈیمیسیو پیرالٹا نے اپنے کھیت کے ساتھ واقع باغ میں اپنی گائے کو چارہ ڈالا، یہ کام اُن کے روزمرہ معمول کا ایک حصہ تھا۔

ڈیمیسیو اپنی اہلیہ اور بچوں کے ہمراہ ریاست نیو میکسیکو کے مضافات میں تین کمروں کے چھوٹے سے گھر میں رہتے تھے اور اُن کے گاؤں کی آبادی اُس وقت فقط ایک ہزار افراد پر مشتمل تھی۔

ان کی اہلیہ فرانسسکویٹا سلوا پیرلٹا اس وقت حاملہ تھیں اور ان کے ہاں دسویں بچے کی پیدائش متوقع تھی۔

لیکن اس صبح اِس جوڑے کی معمول کی زندگی ایک بڑے دھماکے کی آواز سے کچھ بدل گئی، اس دھماکے نے زمین کو ہلا کر رکھ دیا تھا اور دھماکے کے ساتھ ساتھ ’سورج کی روشنی سے زیادہ طاقتور‘ چمک اور دھوئیں کے گہرے بادل اُمڈ آئے تھے۔اس حقیقت سے بے خبر کہ ابھی ابھی انھوں نے کتنا بڑا واقعہ رونما ہوتے دیکھا ہے، ڈیمیسیو اپنے بچوں اور بیوی کی خیریت کی دعائیں مانگتے ہوئے اپنے گھر پہنچے جہاں انھوں نے اپنی بیوی اور دو بڑی بیٹیوں کو ایک کونے میں پناہ لیے اور روتے ہوئے دیکھا۔

اس جوڑے کی سب سے چھوٹی بیٹی جینووا پیرالٹا پورسیلا نے بی بی سی برازیل کو بتایا کہ ’دھماکے سے گھر ہل گیا تھا اور کھڑکیوں کے شیشے ٹوٹ گئے تھے، ہر کوئی سوچ رہا تھا کہ شاید دنیا کا اختتام قریب آن پہنچا ہے۔‘

جب بعد میں ڈیمیسیو اپنے مویشیوں کا معائنہ کرنے کے لیے نزدیک واقع جانوروں کے باڑے میں گئے تو انھوں نے دیکھا کہ ناصرف زمین بلکہ اُن کی تمام گائیں بھی سفید پاؤڈر سے ڈھکی ہوئی تھیں اور ’ہر طرف برف تھی۔‘

چند عرصے بعد پیرالٹا خاندان اور خطے کے دیگر لوگوں نے دھماکے کی وجہ اور آسمان سے گرنے والی راکھ کی اصلیت کا پتا لگایا۔ چند کلومیٹر دور امریکی حکومت نے پہلا ٹیسٹ کیا تھا یعنی دنیا میں پہلا ایٹم بم ٹیسٹ۔

یہ ’ٹرینیٹی ٹیسٹ مین ہٹن پراجیکٹ‘ کا حصہ تھا جو دوسری جنگ عظیم کے دوران ایٹم بم تیار کرنے کا پروگرام تھا۔

اگرچہ بم دھماکے کے لیے منتخب کردہ جگہ جورنڈا ڈیل مورٹو صحرا، ایک دور دراز خطہ سمجھا جاتا ہے، جہاں بہت سے خاندان آس پاس الگ تھلگ کھیتوں اور چھوٹی دیہی برادریوں میں بستے تھے۔

یہ آبادی جن میں سے بہت سے مقامی امریکی یا ہسپانوی نژاد تھے، کا اس خطے سے کبھی بھی انخلا نہیں کیا گیا تھا اور نہ ہی ٹیسٹ کے بارے میں انھیں خبردار کیا گیا۔ اس بات سے بے خبر کہ انھیں تابکاری کا سامنا تھا، یہ مقامی رہائشی اس ٹیسٹ کے بعد بھی معمول کی زندگی انھیں آبادیوں میں گزارتے رہے۔

لیکن حالات نے ثابت کیا کہ اس ٹیسٹ کا ان آبادیوں پر گہرا اثر پڑا۔ 75 سال سے بھی زیادہ عرصے کے بعد زندہ بچ جانے والے اور ان کی اولادیں اس کے اثرات کو دہائیوں تک محسوس کرتی رہیں۔

پورسیلا نے افسوس کا اظہار کرتے ہوئے کہا کہ ’دس (بہن اور بھائیوں) میں سے میں واحد زندہ بچ سکی ہوں۔ باقی سب کینسر سے مر گئے۔‘

اس کے بعد کے جوہری تجربات کے قریبی علاقے کے رہائشیوں کے برعکس جنھیں خراب صحت کی وجہ سے معاوضہ دیا گیا تھا، نیو میکسیکو میں زندہ بچ جانے والوں کی کبھی بھی شناخت نہیں ہو سکی۔

آج تک یہ خاندان ایک سرکاری پروگرام میں شامل ہونے کے منتظر ہیں جو متاثرہ افراد کو معاوضہ فراہم کرتا ہے۔","یاورعباس",NULL,"کنجاہ","15","0","1","0",NULL,NULL,NULL,"2022-03-21 16:48:59","2022-10-07 19:36:22"
"155","منی لانڈرنگ کیس: شہباز شریف اور حمزہ شہباز دونوں کی گرفتاری مطلوب ہے، ایف آئی اے","[""y0k0hF2OcD.png""]","وفاقی تحقیقاتی ادارے (ایف آئی اے) کے وکیل نے لاہور کی خصوصی عدالت میں دلائل دیتے ہوئے تصدیق کی کہ ادارہ 16 ارب روپے منی لانڈرنگ کیس میں وزیر اعظم شہباز شریف اور ان کے صاحبزادے وزیر اعلیٰ پنجاب شہباز شریف کو گرفتار کرنا چاہتا ہے۔

لاہور کی مقامی عدالت میں خصوصی عدالت کے جج اعجاز اعوان نے منی لانڈرنگ کیس سماعت کی، دوران وزیر اعظم شہباز شریف اور ان کے صاحبزادے وزیر اعلیٰ پنجاب حمزہ شہباز عدالت میں پیش ہوئے۔

دوران سماعت شہباز شریف اور حمزہ شہباز کے وکیل امجد پرویز عبوری ضمانت کی توثیق پر دلائل دیے

انہوں نے کہا کہ ڈیڑھ سال تک تحقیقات کی گئیں لیکن ایف آئی اے کوئی شواہد ریکارڈ پر نہ لا سکا، پچھلے دور میں بدترین سیاسی انجینئرنگ کی گئی جبکہ لاہور ہائیکورٹ بھی سیاسی انجینئرنگ کو حقیقت قرار دے چکی ہے۔","عبدالستارمرزا",NULL,"گجرات","14","1","1","0",NULL,NULL,NULL,"2022-06-04 16:00:49","2022-06-04 16:01:44"
